{"schema_version":3,"gate_id":"gate_3da467e486fadd8b","run_id":"run_bc31520c3a704c07","pre_gate_event_digest":"sha256:c112fc952165c9158400d2ba3f5c383df9e34d8e9e6e18b3dd3f9363afe45742","passed":true,"invoked_count":1,"started_at":"2026-08-05T13:11:03.874Z","finished_at":"2026-08-05T13:11:23.997Z","checks":[{"name":"catalog_validate","script":"catalog:validate","passed":true,"exit_code":0,"duration_ms":555},{"name":"catalog_status","script":"catalog:status","passed":true,"exit_code":0,"duration_ms":1000},{"name":"catalog_reset_test","script":"catalog:reset:test","passed":true,"exit_code":0,"duration_ms":670},{"name":"skill_extraction_test","script":"skill:extraction:test","passed":true,"exit_code":0,"duration_ms":138},{"name":"skill_normalization_bootstrap_test","script":"skill:normalization:bootstrap:test","passed":true,"exit_code":0,"duration_ms":172},{"name":"analysis_binding_test","script":"analysis:binding:test","passed":true,"exit_code":0,"duration_ms":3203},{"name":"relations_v2_test","script":"relations:v2:test","passed":true,"exit_code":0,"duration_ms":619},{"name":"pack_schema_test","script":"pack:schema:test","passed":true,"exit_code":0,"duration_ms":123},{"name":"pack_core_test","script":"pack:core:test","passed":true,"exit_code":0,"duration_ms":134},{"name":"pack_preflight_test","script":"pack:preflight:test","passed":true,"exit_code":0,"duration_ms":138},{"name":"pack_proof_test","script":"pack:proof:test","passed":true,"exit_code":0,"duration_ms":3209},{"name":"pack_promotion_test","script":"pack:promotion:test","passed":true,"exit_code":0,"duration_ms":179},{"name":"pack_destination_test","script":"pack:destination:test","passed":true,"exit_code":0,"duration_ms":2579},{"name":"evaluation_binding_test","script":"evaluation:binding:test","passed":true,"exit_code":0,"duration_ms":2119},{"name":"path_safety_test","script":"path:safety:test","passed":true,"exit_code":0,"duration_ms":280},{"name":"issue_intake_test","script":"issue:intake:test","passed":true,"exit_code":0,"duration_ms":276},{"name":"issue_response_ledger_test","script":"issue:response-ledger:test","passed":true,"exit_code":0,"duration_ms":138},{"name":"issue_pipeline_test","script":"issue:pipeline:test","passed":true,"exit_code":0,"duration_ms":140},{"name":"issue_stage_test","script":"issue:stage:test","passed":true,"exit_code":0,"duration_ms":232},{"name":"source_http_classifier_test","script":"source:http-classifier:test","passed":true,"exit_code":0,"duration_ms":148},{"name":"publish_check","script":"publish:check","passed":true,"exit_code":0,"duration_ms":740},{"name":"publish_links","script":"publish:links","passed":true,"exit_code":0,"duration_ms":420},{"name":"publish_boundary","script":"publish:boundary","passed":true,"exit_code":0,"duration_ms":175},{"name":"publish_summaries","script":"publish:summaries","passed":true,"exit_code":0,"duration_ms":247},{"name":"publish_pack_v3_test","script":"publish:pack-v3:test","passed":true,"exit_code":0,"duration_ms":127},{"name":"nightly_runtime_test","script":"nightly:runtime:test","passed":true,"exit_code":0,"duration_ms":1424},{"name":"nightly_controller_test","script":"nightly:controller:test","passed":true,"exit_code":0,"duration_ms":571},{"name":"nightly_legacy_absence_test","script":"nightly:legacy-absence:test","passed":true,"exit_code":0,"duration_ms":111},{"name":"catalog_impact","script":"catalog:impact","passed":true,"exit_code":0,"duration_ms":240}],"evidence_logs":[{"check_name":"catalog_validate","stdout_digest":"sha256:79cf18501487efe12539589ce1d501e0010f55c609fa591bc5722495f35218c1","stderr_digest":"sha256:e3b0c44298fc1c149afbf4c8996fb92427ae41e4649b934ca495991b7852b855","stdout_path":"catalog_validate.stdout.log","stderr_path":"catalog_validate.stderr.log"},{"check_name":"catalog_status","stdout_digest":"sha256:f331ed97a2cff30aaec60923234cbe4049c49655b8315175fdb20b52837ba98d","stderr_digest":"sha256:e3b0c44298fc1c149afbf4c8996fb92427ae41e4649b934ca495991b7852b855","stdout_path":"catalog_status.stdout.log","stderr_path":"catalog_status.stderr.log"},{"check_name":"catalog_reset_test","stdout_digest":"sha256:dccfe489dd3be42eaffef852dca4b83269f1638297be03a75e5c86ab875ea34d","stderr_digest":"sha256:e3b0c44298fc1c149afbf4c8996fb92427ae41e4649b934ca495991b7852b855","stdout_path":"catalog_reset_test.stdout.log","stderr_path":"catalog_reset_test.stderr.log"},{"check_name":"skill_extraction_test","stdout_digest":"sha256:fafe24db0cabbea2851e2a14007ae42e5d87abb0ee54e2074a72a15bcb6b0708","stderr_digest":"sha256:e3b0c44298fc1c149afbf4c8996fb92427ae41e4649b934ca495991b7852b855","stdout_path":"skill_extraction_test.stdout.log","stderr_path":"skill_extraction_test.stderr.log"},{"check_name":"skill_normalization_bootstrap_test","stdout_digest":"sha256:eb95abebe6cb6ca7ae8531386fbc42bce60e36213bbe13ce1e706ef1ed889f54","stderr_digest":"sha256:e3b0c44298fc1c149afbf4c8996fb92427ae41e4649b934ca495991b7852b855","stdout_path":"skill_normalization_bootstrap_test.stdout.log","stderr_path":"skill_normalization_bootstrap_test.stderr.log"},{"check_name":"analysis_binding_test","stdout_digest":"sha256:4b9f36f24d418f95602c19ac74a910458015a02f36b54aeaed3283c4439d8ce8","stderr_digest":"sha256:e3b0c44298fc1c149afbf4c8996fb92427ae41e4649b934ca495991b7852b855","stdout_path":"analysis_binding_test.stdout.log","stderr_path":"analysis_binding_test.stderr.log"},{"check_name":"relations_v2_test","stdout_digest":"sha256:81915fcc859c8928762c67ef4ce3d58437942036752b2a14b7d5276fb2bc8c7c","stderr_digest":"sha256:e3b0c44298fc1c149afbf4c8996fb92427ae41e4649b934ca495991b7852b855","stdout_path":"relations_v2_test.stdout.log","stderr_path":"relations_v2_test.stderr.log"},{"check_name":"pack_schema_test","stdout_digest":"sha256:ce78d2c242bfc1b7c21995ba36ca66f24a239d9e4c34960dab7be6ead7ca47a8","stderr_digest":"sha256:e3b0c44298fc1c149afbf4c8996fb92427ae41e4649b934ca495991b7852b855","stdout_path":"pack_schema_test.stdout.log","stderr_path":"pack_schema_test.stderr.log"},{"check_name":"pack_core_test","stdout_digest":"sha256:20c73070c9e2e54169bcaa5885ef3d2ac545c091552a430a12178c8e8638d4f6","stderr_digest":"sha256:e3b0c44298fc1c149afbf4c8996fb92427ae41e4649b934ca495991b7852b855","stdout_path":"pack_core_test.stdout.log","stderr_path":"pack_core_test.stderr.log"},{"check_name":"pack_preflight_test","stdout_digest":"sha256:d49ce0bde43722d29bb25331d935a6d2c5383b2ba70566ff38ea43a879daea1f","stderr_digest":"sha256:e3b0c44298fc1c149afbf4c8996fb92427ae41e4649b934ca495991b7852b855","stdout_path":"pack_preflight_test.stdout.log","stderr_path":"pack_preflight_test.stderr.log"},{"check_name":"pack_proof_test","stdout_digest":"sha256:d04fe6b8419cf279ff19b7cf23b8efdf9c4ecc79b8797ba32e21a6d8d7f3f083","stderr_digest":"sha256:e3b0c44298fc1c149afbf4c8996fb92427ae41e4649b934ca495991b7852b855","stdout_path":"pack_proof_test.stdout.log","stderr_path":"pack_proof_test.stderr.log"},{"check_name":"pack_promotion_test","stdout_digest":"sha256:720c27faeb9388f8440a2361603cd50bdaa41e8aafbb0d759c8173ba2ca83184","stderr_digest":"sha256:e3b0c44298fc1c149afbf4c8996fb92427ae41e4649b934ca495991b7852b855","stdout_path":"pack_promotion_test.stdout.log","stderr_path":"pack_promotion_test.stderr.log"},{"check_name":"pack_destination_test","stdout_digest":"sha256:832d15a58dae94985f4be936550271115b87658c16efb01c260fd1722dba5701","stderr_digest":"sha256:e3b0c44298fc1c149afbf4c8996fb92427ae41e4649b934ca495991b7852b855","stdout_path":"pack_destination_test.stdout.log","stderr_path":"pack_destination_test.stderr.log"},{"check_name":"evaluation_binding_test","stdout_digest":"sha256:f41c54a3d76fb2c9549e09b24d2abc48fbba31b70992b596e9e13b2765c71bd9","stderr_digest":"sha256:e3b0c44298fc1c149afbf4c8996fb92427ae41e4649b934ca495991b7852b855","stdout_path":"evaluation_binding_test.stdout.log","stderr_path":"evaluation_binding_test.stderr.log"},{"check_name":"path_safety_test","stdout_digest":"sha256:7f7c39db55c99d613a20afa6b168e205f355d50f83c2465beb6b97eb23bbc2ca","stderr_digest":"sha256:e3b0c44298fc1c149afbf4c8996fb92427ae41e4649b934ca495991b7852b855","stdout_path":"path_safety_test.stdout.log","stderr_path":"path_safety_test.stderr.log"},{"check_name":"issue_intake_test","stdout_digest":"sha256:3392bca3012f15989c4516c2e96470dec6aa807f7c94e18a078aec6abe7856d5","stderr_digest":"sha256:e3b0c44298fc1c149afbf4c8996fb92427ae41e4649b934ca495991b7852b855","stdout_path":"issue_intake_test.stdout.log","stderr_path":"issue_intake_test.stderr.log"},{"check_name":"issue_response_ledger_test","stdout_digest":"sha256:db8635e965080d8fd35aeda581f98a2760743c22ddfaadc4d978a34ec80517f8","stderr_digest":"sha256:e3b0c44298fc1c149afbf4c8996fb92427ae41e4649b934ca495991b7852b855","stdout_path":"issue_response_ledger_test.stdout.log","stderr_path":"issue_response_ledger_test.stderr.log"},{"check_name":"issue_pipeline_test","stdout_digest":"sha256:82e6c5f123bcbc21646338a7fbabf9ad9f498b1c3d1a573abb5bd1a0b3ef8e08","stderr_digest":"sha256:e3b0c44298fc1c149afbf4c8996fb92427ae41e4649b934ca495991b7852b855","stdout_path":"issue_pipeline_test.stdout.log","stderr_path":"issue_pipeline_test.stderr.log"},{"check_name":"issue_stage_test","stdout_digest":"sha256:b3bcfbcc53dba5c188f17c863c73b720f6542bfe6fe2d830a505943cda2edba9","stderr_digest":"sha256:e3b0c44298fc1c149afbf4c8996fb92427ae41e4649b934ca495991b7852b855","stdout_path":"issue_stage_test.stdout.log","stderr_path":"issue_stage_test.stderr.log"},{"check_name":"source_http_classifier_test","stdout_digest":"sha256:f69876d4d41386051cd5bf23c6591dab9e8d6ebd666add006b1e9222b13b1b70","stderr_digest":"sha256:e3b0c44298fc1c149afbf4c8996fb92427ae41e4649b934ca495991b7852b855","stdout_path":"source_http_classifier_test.stdout.log","stderr_path":"source_http_classifier_test.stderr.log"},{"check_name":"publish_check","stdout_digest":"sha256:065c9d1f04603b6e02b9ef083b518b7b1e4be59b1a59e84a582bdcf3f17efce4","stderr_digest":"sha256:e3b0c44298fc1c149afbf4c8996fb92427ae41e4649b934ca495991b7852b855","stdout_path":"publish_check.stdout.log","stderr_path":"publish_check.stderr.l